symbol,headline
CUE,Which stocks are moving on Friday?
CUE,Let's uncover which stocks are experiencing notable gaps during today's session.
CUE,Stay updated with the stocks that are on the move in today's pre-market session.
CUE,12 Health Care Stocks Moving In Friday's Pre-Market Session
CUE,Market-Moving News for May 1st
CUE,Why Twilio Shares Are Trading Higher By Over 20%; Here Are 20 Stocks Moving Premarket
SAFX,XCF Global Continues New Rise Reno Planned Upgrade and Secures Forbearance Agreement Related to New Rise Renewables Reno Ground Lease
NSPR,InspireMD Announces FDA Approval of Investigational Device Exemption Application for CGUARDIANS III Pivotal Study of the SwitchGuard Neuro Protection System
NSPR,InspireMD Q1 2026 Earnings Preview
UONE,Urban One Announces Agreements to Acquire Dallas Radio Stations KKDA and KRNB and to Sell KZMJ
PN,Which stocks are moving on Friday?
STAK,What's going on in today's session
STAK,Which stocks are moving on Friday?
CELU,"Celularity Announces Filing of Form 10-K, Regains Nasdaq Compliance and Highlights Continued Strategic Transformation"
SOBR,What's going on in today's session
SOBR,Friday's session: most active stocks
SOBR,Which stocks are moving on Friday?
SOBR,Let's uncover which stocks are experiencing notable gaps during today's session.
SOBR,12 Information Technology Stocks Moving In Friday's Pre-Market Session
CJMB,12 Industrials Stocks Moving In Friday's Pre-Market Session
